{
  "bad_tf": "resource \"azurerm_network_security_rule\" \"rdp\" {\n  name                        = \"allow-rdp\"\n  priority                    = 100\n  direction                   = \"Inbound\"\n  access                      = \"Allow\"\n  protocol                    = \"Tcp\"\n  source_port_range           = \"*\"\n  destination_port_range      = \"3389\"\n  source_address_prefix       = \"*\"\n  destination_address_prefix  = \"*\"\n  resource_group_name         = \"example-rg\"\n  network_security_group_name = \"example-nsg\"\n}\n",
  "good_tf": "resource \"azurerm_network_security_rule\" \"rdp\" {\n  name                        = \"allow-rdp\"\n  priority                    = 100\n  direction                   = \"Inbound\"\n  access                      = \"Allow\"\n  protocol                    = \"Tcp\"\n  source_port_range           = \"*\"\n  destination_port_range      = \"3389\"\n  source_address_prefix       = \"10.0.0.0/16\" # FIX: restrict source to internal virtual network CIDR\n  destination_address_prefix  = \"*\"\n  resource_group_name         = \"example-rg\"\n  network_security_group_name = \"example-nsg\"\n}\n",
  "why_it_matters": [
    "Setting source_address_prefix to '*' exposes TCP port 3389 directly to the public internet, allowing any remote IP address to initiate RDP handshakes against attached virtual machines.",
    "Attackers scan public ranges for open port 3389 to launch brute-force password guessing or exploit unpatched vulnerabilities in the Remote Desktop Protocol service.",
    "Restricting source_address_prefix to a trusted internal CIDR like 10.0.0.0/16 blocks unauthorized external traffic at the network security group before it touches the OS."
  ],
  "post_en": "You apply source_address_prefix = \"*\" on an inbound rule allowing destination port 3389.\n\nStep 1: An internet scanner detects an open TCP socket on port 3389 at your public IP address.\nStep 2: The attacker initiates Remote Desktop Protocol handshakes to enumerate local accounts and brute-force credentials.\nStep 3: After authenticating into an interactive session, the attacker executes scripts to dump memory and pivot deeper into your virtual network.\n\nInbound network security rules that permit traffic to port 3389 from any source address are blocked.\nChange source_address_prefix to a trusted private CIDR like 10.0.0.0/16.\n\nWould your pipeline catch this inbound security rule before apply?"
}
