{
  "bad_tf": "resource \"aws_s3_bucket\" \"data\" {\n  bucket = \"example-data-bucket\"\n}\n\nresource \"aws_s3_bucket_public_access_block\" \"data\" {\n  bucket                  = aws_s3_bucket.data.id\n  block_public_acls       = false\n  block_public_policy     = false\n  ignore_public_acls      = false\n  restrict_public_buckets = false\n}\n",
  "good_tf": "resource \"aws_s3_bucket\" \"data\" {\n  bucket = \"example-data-bucket\"\n}\n\nresource \"aws_s3_bucket_public_access_block\" \"data\" {\n  bucket                  = aws_s3_bucket.data.id\n  block_public_acls       = true # FIX: reject new public ACLs\n  block_public_policy     = true # FIX: reject public bucket policies\n  ignore_public_acls      = true # FIX: ignore existing public ACLs\n  restrict_public_buckets = true # FIX: only AWS principals in this account\n}\n\nresource \"aws_s3_bucket_ownership_controls\" \"data\" { # FIX: disable ACLs entirely\n  bucket = aws_s3_bucket.data.id\n  rule {\n    object_ownership = \"BucketOwnerEnforced\" # FIX: bucket owner owns every object\n  }\n}\n",
  "why_it_matters": [
    "Any principal with s3:PutObjectAcl can mark an object public-read, making it readable by anonymous HTTPS GetObject requests.",
    "Public ACLs bypass the bucket policy review that teams usually rely on, so exposure can happen through a single API call.",
    "block_public_acls makes S3 reject the PutObjectAcl and PutBucketAcl requests that would grant public access."
  ],
  "post_en": "One false flag on an S3 public access block is enough for a single PutObjectAcl call to expose an object to the whole internet.\n\nCKV_AWS_53 fails any aws_s3_bucket_public_access_block that leaves block_public_acls off, the setting that makes S3 reject any request that tries to attach a public ACL to the bucket or its objects.\n\nWhy it matters: anyone with s3:PutObjectAcl or s3:PutBucketAcl, including a leaked CI credential or a well-meaning teammate, can grant public-read. Anonymous clients can then fetch the object with a plain HTTPS GetObject, no AWS credentials needed. The public access block is a bucket-level guardrail that overrides those ACLs even when someone gets them wrong later.\n\nThe fix: set block_public_acls = true (and its three siblings) on aws_s3_bucket_public_access_block, and enforce BucketOwnerEnforced ownership so ACLs stop mattering at all.\n\nEvery snippet in this series is checked by Terraform and Checkov before it is posted: the misconfigured version must fail the rule and the fixed version must pass it.\n\nDo you enforce Block Public Access at the account level, or still bucket by bucket?"
}