{
  "bad_tf": "resource \"aws_security_group\" \"example\" {\n  name        = \"example\"\n  description = \"Example security group\"\n\n  ingress {\n    from_port   = 22\n    to_port     = 22\n    protocol    = \"tcp\"\n    cidr_blocks = [\"0.0.0.0/0\"]\n  }\n}\n",
  "good_tf": "resource \"aws_security_group\" \"example\" {\n  name        = \"example\"\n  description = \"Example security group\"\n\n  ingress {\n    from_port   = 22\n    to_port     = 22\n    protocol    = \"tcp\"\n    cidr_blocks = [\"10.0.0.0/16\"] # FIX: restrict SSH to internal CIDR\n  }\n}\n",
  "why_it_matters": [
    "Exposing SSH port 22 to 0.0.0.0/0 leaves instances vulnerable to internet-wide brute force attacks and automated credential stuffing attempts.",
    "Attackers scanning public IP ranges can directly attempt unauthorized administrative access to remote management shells on instances.",
    "Restricting ingress to trusted CIDR blocks confines administrative shell exposure to private corporate networks or bastion hosts."
  ],
  "post_en": "Exposing port 22 directly to the public internet invites automated reconnaissance and persistent brute-force attacks against administrative interfaces.\n\nCheckov check CKV_AWS_24 evaluates AWS security groups to ensure they do not permit inbound network traffic to TCP port 22 from the public internet address 0.0.0.0/0.\n\nLeaving SSH open to all IP addresses allows any unauthorized actor on the internet to attempt credential stuffing or exploit potential OpenSSH daemon vulnerabilities. If an instance accepts connections indiscriminately, an attacker only needs compromised credentials or an unpatched flaw to obtain an interactive shell and move laterally through your cloud environment. Restricting administrative access to private ranges shields instances from automated internet-wide scanning while enforcing access control through dedicated bastions, corporate VPNs, or AWS Systems Manager.\n\nTo resolve this issue, update the ingress rule by setting cidr_blocks to a trusted internal network such as 10.0.0.0/16 or specific administrator IP addresses instead of 0.0.0.0/0.\n\nHow do you currently enforce secure remote access to EC2 instances across your environments without opening public management ports?"
}
