{
  "bad_tf": "resource \"aws_lambda_function\" \"example\" {\n  function_name = \"example-function\"\n  role          = \"arn:aws:iam::123456789012:role/example-role\"\n  handler       = \"index.handler\"\n  runtime       = \"nodejs20.x\"\n  filename      = \"lambda.zip\"\n\n  environment {\n    variables = {\n      AWS_ACCESS_KEY_ID = \"AKIAIOSFODNN7EXAMPLE\"\n    }\n  }\n}\n",
  "good_tf": "resource \"aws_lambda_function\" \"example\" {\n  function_name = \"example-function\"\n  role          = \"arn:aws:iam::123456789012:role/example-role\"\n  handler       = \"index.handler\"\n  runtime       = \"nodejs20.x\"\n  filename      = \"lambda.zip\"\n\n  environment {\n    variables = {\n      SECRET_NAME = \"example-secret-name\" # FIX: store secret reference instead of plaintext key\n    }\n  }\n}\n",
  "why_it_matters": [
    "Anyone with lambda:GetFunction permissions can read plaintext environment variables directly through the AWS Console or the lambda:GetFunctionConfiguration API.",
    "Hard-coded credentials in environment variables leak into deployment logs and state files, granting unauthorized users persistent access to target services.",
    "Referencing secret names forces runtime retrieval via AWS Secrets Manager using IAM role-based authentication and audit-logged API calls."
  ],
  "post_en": "An access key string committed to a Lambda environment block is currently sitting in the review queue awaiting production deployment.\n\nPlease drop this static key from the environment configuration. Storing access keys inside function variables writes long-lived credentials into version control, deployment plans, and state files. Any identity with lambda:GetFunctionConfiguration or read access to the repository can capture the key and authenticate against your cloud APIs directly without an audit trail.\n\nInstead of passing static credentials here, configure the function to rely on its IAM execution role or pass a secret identifier like SECRET_NAME pointing to AWS Secrets Manager. The function can retrieve short-lived tokens or dynamic secrets at runtime over HTTPS using IAM authorization.\n\nCKV_AWS_45 would have flagged this embedded credential automatically before it merged.\n\nReviewers should never accept plaintext credentials in configuration when execution roles and secret managers eliminate the need for static keys."
}
