{
  "bad_tf": "resource \"azurerm_linux_virtual_machine\" \"example\" {\n  name                            = \"example-vm\"\n  resource_group_name             = \"example-resources\"\n  location                        = \"eastus\"\n  size                            = \"Standard_B1s\"\n  admin_username                  = \"adminuser\"\n  admin_password                  = \"P@ssw0rd1234!\"\n  disable_password_authentication = false\n  network_interface_ids           = [\"/subscriptions/00000000-0000-0000-0000-000000000000/resourceGroups/example-resources/providers/Microsoft.Network/networkInterfaces/example-nic\"]\n\n  os_disk {\n    caching              = \"ReadWrite\"\n    storage_account_type = \"Standard_LRS\"\n  }\n\n  source_image_reference {\n    publisher = \"Canonical\"\n    offer     = \"0001-com-ubuntu-server-jammy\"\n    sku       = \"22_04-lts\"\n    version   = \"latest\"\n  }\n}\n",
  "good_tf": "resource \"azurerm_linux_virtual_machine\" \"example\" {\n  name                            = \"example-vm\"\n  resource_group_name             = \"example-resources\"\n  location                        = \"eastus\"\n  size                            = \"Standard_B1s\"\n  admin_username                  = \"adminuser\"\n  disable_password_authentication = true # FIX: require SSH keys over passwords\n  network_interface_ids           = [\"/subscriptions/00000000-0000-0000-0000-000000000000/resourceGroups/example-resources/providers/Microsoft.Network/networkInterfaces/example-nic\"]\n\n  admin_ssh_key {                                                                                                    # FIX: configure SSH key authentication\n    username   = \"adminuser\"                                                                                         # FIX: match virtual machine admin username\n    public_key = \"ssh-ed25519 AAAAC3NzaC1lZDI1NTE5AAAAIOMqqnkVzrm0SdG6UOoqKLsabgH5C9okWi0dh2l9GKJl test@example.com\" # FIX: authorized public key content\n  }                                                                                                                  # FIX: close admin_ssh_key block\n\n  os_disk {\n    caching              = \"ReadWrite\"\n    storage_account_type = \"Standard_LRS\"\n  }\n\n  source_image_reference {\n    publisher = \"Canonical\"\n    offer     = \"0001-com-ubuntu-server-jammy\"\n    sku       = \"22_04-lts\"\n    version   = \"latest\"\n  }\n}\n",
  "why_it_matters": [
    "Attackers targeting SSH ports can execute brute-force and dictionary attacks against VMs that permit password-based logins.",
    "Compromised passwords allow unauthorized shell access to the guest operating system and any cloud credentials stored on or accessible from the host.",
    "Disabling password authentication forces key-based SSH authentication, eliminating credential stuffing and brute-force access vectors over port 22."
  ],
  "post_en": "Myth: Complex Linux passwords combined with network security groups make SSH password authentication safe enough for virtual machines.\n\nFact: Network perimeter rules frequently drift or loosen during maintenance, exposing port 22 to wider subnets or the internet. Automated scanners continuously probe open SSH ports, executing brute-force and credential stuffing attacks against local user accounts without encountering aggressive lockouts by default.\n\nCKV_AZURE_149 triggers when an Azure Linux virtual machine sets disable_password_authentication to false.\n\nSet disable_password_authentication to true and configure an admin_ssh_key block with a trusted public key instead.\n\nWhich network security assumption has your team had to unlearn the hard way?"
}
