{
  "bad_tf": "resource \"azurerm_resource_group\" \"example\" {\n  name     = \"example-resources\"\n  location = \"eastus\"\n}\n\nresource \"azurerm_kubernetes_cluster\" \"example\" {\n  name                    = \"example-aks\"\n  location                = azurerm_resource_group.example.location\n  resource_group_name     = azurerm_resource_group.example.name\n  dns_prefix              = \"exampleaks\"\n  private_cluster_enabled = true\n  local_account_disabled  = false\n\n  default_node_pool {\n    name       = \"default\"\n    node_count = 1\n    vm_size    = \"Standard_DS2_v2\"\n  }\n\n  identity {\n    type = \"SystemAssigned\"\n  }\n}\n",
  "good_tf": "resource \"azurerm_resource_group\" \"example\" {\n  name     = \"example-resources\"\n  location = \"eastus\"\n}\n\nresource \"azurerm_kubernetes_cluster\" \"example\" {\n  name                    = \"example-aks\"\n  location                = azurerm_resource_group.example.location\n  resource_group_name     = azurerm_resource_group.example.name\n  dns_prefix              = \"exampleaks\"\n  private_cluster_enabled = true\n  local_account_disabled  = true # FIX: disable local admin accounts\n\n  default_node_pool {\n    name       = \"default\"\n    node_count = 1\n    vm_size    = \"Standard_DS2_v2\"\n  }\n\n  identity {\n    type = \"SystemAssigned\"\n  }\n}\n",
  "why_it_matters": [
    "Enabled local admin accounts provide cluster-admin kubeconfig credentials through the Azure management API to anyone with Azure RBAC contributor access.",
    "Attackers with subscription-level read or action permissions can invoke listClusterAdminCredentials to bypass Entra ID authentication and auditing.",
    "Disabling local accounts forces all Kubernetes API interactions through centralized identity providers and Azure RBAC role assignments."
  ],
  "post_en": "AKS clusters with local accounts enabled allow anyone with Azure RBAC access to retrieve static cluster-admin kubeconfig files.\nSet local_account_disabled to true on azurerm_kubernetes_cluster to force all cluster access through Microsoft Entra ID.\nThis blocks attackers from extracting cluster-admin credentials via the ARM API and bypassing conditional access policies.\nCKV_AZURE_141 fails the first version and passes the second."
}
