{
  "bad_tf": "resource \"azurerm_resource_group\" \"example\" {\n  name     = \"example-resources\"\n  location = \"eastus\"\n}\n\nresource \"azurerm_storage_account\" \"example\" {\n  name                          = \"examplestorageacc\"\n  resource_group_name           = azurerm_resource_group.example.name\n  location                      = azurerm_resource_group.example.location\n  account_tier                  = \"Standard\"\n  account_replication_type      = \"LRS\"\n  public_network_access_enabled = false\n\n  allow_nested_items_to_be_public = true\n}\n",
  "good_tf": "resource \"azurerm_resource_group\" \"example\" {\n  name     = \"example-resources\"\n  location = \"eastus\"\n}\n\nresource \"azurerm_storage_account\" \"example\" {\n  name                          = \"examplestorageacc\"\n  resource_group_name           = azurerm_resource_group.example.name\n  location                      = azurerm_resource_group.example.location\n  account_tier                  = \"Standard\"\n  account_replication_type      = \"LRS\"\n  public_network_access_enabled = false\n\n  allow_nested_items_to_be_public = false # FIX: disable public access for nested blobs\n}\n",
  "why_it_matters": [
    "Anonymous users on the internet can read blob data over HTTPS if containers or blobs are configured for public read access.",
    "Attackers can crawl and discover exposed containers using standard Azure Blob storage REST API requests without credentials.",
    "Setting allow_nested_items_to_be_public to false overrides container settings and blocks all anonymous read traffic."
  ],
  "post_en": "Can individual blob containers still permit anonymous internet reads if your storage account defaults seem secure?\n\nThe static analysis rule inspects the allow_nested_items_to_be_public argument on each azurerm_storage_account resource. It expects the boolean value to be false. If this argument is set to true, or if you omit it entirely from the configuration, the resource fails verification.\n\nA common surprise is that simply omitting allow_nested_items_to_be_public results in a failure. Even if no containers currently permit anonymous access, leaving out an explicit false declaration leaves the resource open to future container-level exposure.\n\nWhen nested items are permitted to be public, anyone can pull sensitive objects over standard REST endpoints without authenticating, bypassing private networking and authorization boundaries.\n\nTo fix this violation, set allow_nested_items_to_be_public to false on the azurerm_storage_account resource.\n\nWhich Azure Policy definitions do you pair with code scanning to block anonymous blob traffic in live subscriptions?"
}
