{
  "bad_tf": "resource \"google_compute_firewall\" \"bad\" {\n  name    = \"bad-firewall\"\n  network = \"default\"\n\n  allow {\n    protocol = \"tcp\"\n    ports    = [\"3389\"]\n  }\n\n  source_ranges = [\"0.0.0.0/0\"]\n}\n",
  "good_tf": "resource \"google_compute_firewall\" \"bad\" {\n  name    = \"bad-firewall\"\n  network = \"default\"\n\n  allow {\n    protocol = \"tcp\"\n    ports    = [\"3389\"]\n  }\n\n  source_ranges = [\"10.0.0.0/8\"] # FIX: restrict RDP ingress to internal network\n}\n",
  "why_it_matters": [
    "An internet-wide source range of 0.0.0.0/0 exposes the Remote Desktop Protocol service on port 3389 directly to arbitrary external IP addresses.",
    "External attackers can target open RDP endpoints with automated credential brute-force attacks or exploit protocol vulnerabilities to gain interactive graphical sessions.",
    "Restricting the firewall rule to trusted internal CIDR ranges blocks unauthenticated internet traffic while keeping administrative access confined to private networks."
  ],
  "post_en": "Can a firewall rule that omits the direction argument still expose port 3389 to the entire internet?\n\nThe check targets google_compute_firewall resources and evaluates ingress configurations granting access to TCP port 3389, the standard port for Remote Desktop Protocol. It inspects the allow block for protocols and ports that include 3389, alongside the source_ranges attribute. Any rule permitting port 3389 where source_ranges includes 0.0.0.0/0 fails immediately. Rules specifying restricted CIDR blocks, such as private RFC 1918 subnets, pass.\n\nA detail that surprises many engineers is that the direction argument defaults to INGRESS when omitted in Terraform. A firewall rule declared without an explicit direction will still be evaluated as an ingress rule, meaning an open source range on port 3389 triggers a failure even if direction was never specified.\n\nBroad exposure on port 3389 allows external adversaries to reach Windows compute instances directly over RDP. Attackers routinely probe open endpoints to attempt credential stuffing, brute-force administrative accounts, and establish interactive graphical sessions inside the VPC.\n\nTo resolve this, replace the open 0.0.0.0/0 CIDR in source_ranges with trusted private IP blocks such as 10.0.0.0/8 or dedicated bastion subnet ranges.\n\nWhich automated controls do you run alongside static analysis to detect overly permissive ingress rules?"
}
