{
  "bad_tf": "resource \"aws_s3_bucket\" \"example\" {\n  bucket = \"example-bucket-name\"\n}\n\nresource \"aws_s3_bucket_public_access_block\" \"example\" {\n  bucket                  = aws_s3_bucket.example.id\n  block_public_acls       = false\n  block_public_policy     = true\n  ignore_public_acls      = true\n  restrict_public_buckets = true\n}\n",
  "good_tf": "resource \"aws_s3_bucket\" \"example\" {\n  bucket = \"example-bucket-name\"\n}\n\nresource \"aws_s3_bucket_public_access_block\" \"example\" {\n  bucket                  = aws_s3_bucket.example.id\n  block_public_acls       = true # FIX: Enable blocking of public ACLs\n  block_public_policy     = true\n  ignore_public_acls      = true\n  restrict_public_buckets = true\n}\n",
  "why_it_matters": [
    "An attacker can exploit overly permissive object access control lists over the S3 API to read or write private cloud storage objects.",
    "Unrestricted access control lists allow anonymous or public principals to bypass intended authorization boundaries on sensitive data buckets.",
    "Enabling block public ACLs stops the S3 service from accepting requests that attempt to grant public permissions via object and bucket access control lists."
  ],
  "post_en": "Leaving cloud storage buckets vulnerable to public access control lists exposes sensitive assets to unauthorized external actors over the internet.\n\nCheckov check CKV_AWS_53 inspects the configuration of the aws_s3_bucket_public_access_block resource to ensure that public access control lists are explicitly blocked.\n\nAn attacker can exploit overly permissive object access control lists over the S3 API to read or write private cloud storage objects. Unrestricted access control lists allow anonymous or public principals to bypass intended authorization boundaries on sensitive data buckets. Enabling block public ACLs stops the S3 service from accepting requests that attempt to grant public permissions via object and bucket access control lists.\n\nThe fix is to set the block_public_acls argument to true on the aws_s3_bucket_public_access_block resource.\n\nHow do you ensure your infrastructure code consistently enforces public access blocks across all cloud storage accounts?"
}
